Key,Context,Example,Source,en-us,ar-001,de-de,es-es,fr-fr,id-id,it-it,ja-jp,ko-kr,pl-pl,pt-br,ru-ru,th-th,tr-tr,vi-vn,zh-cjv,zh-cn,zh-tw
Studio.UpdateNotifications.Ribbon.WhatsNewButton,,,What's New,What's New,,Was gibt es Neues?,Lo más nuevo,Quoi de neuf,,Novità,新着情報,새로운 소식,,Novidades,Что нового?,,Neler yeni?,Có Gì Mới,新增功能,新增功能,最新消息
Studio.UpdateNotifications.Ribbon.WhatsNewTooltip,,,Click this button to see what's new with Studio and our developer community!,Click this button to see what's new with Studio and our developer community!,,"Klicke auf diese Schaltfläche, um zu sehen, was es Neues bei Studio und unserer Entwickler-Community gibt!",Haz clic en este botón para ver qué hay de nuevo en Studio y en nuestra comunidad de desarrolladores.,Cliquer sur ce bouton pour découvrir l'actualité de Studio et de la communauté des développeurs !,,Clicca questo pulsante per scoprire le novità con Studio e la nostra community di sviluppatori!,このボタンをクリックして、Studio と当社の開発者コミュニティで新着情報を見る！,이 버튼을 클릭해 Studio 및 개발자 커뮤니티의 새로운 소식을 확인하세요!,,Clique neste botão para ver as novidades do Studio e de nossa comunidade de desenvolvedores!,"Нажми эту кнопку, чтобы посмотреть, что нового в Studio и в нашем сообществе разработчиков!",,Studio'daki ve geliştirici topluluğumuzdaki yenilikleri görmek için buraya tıkla!,Nhấp vào nút này để khám phá những điều mới từ Studio và cộng đồng nhà phát triển của chúng tôi!,单击此按钮以查看 Studio 和我们的开发者社区的新功能!,单击此按钮以查看 Studio 和我们的开发者社区的新功能!,按下此按鈕，看看 Studio 和開發者社群的最新消息！
Studio.UpdateNotifications.Ribbon.UpdateAvailableButton,,,Update Available,Update Available,,Update verfügbar,Actualización disponible,Mise à jour disponible,,Aggiornamento disponibile,更新できます,업데이트 가능,,Atualização disponível,Доступно обновление,,Güncelleme mevcut,Đã có bản cập nhật,有可用更新,有可用更新,有可用更新
Studio.UpdateNotifications.OSVersionWarning.MacOS1012,,,"Starting at the end of May 2022 we will be discontinuing support for OS X 10.11 and MacOS 10.12.  <a href=""https://support.apple.com/en-us/HT211683"">Please upgrade to MacOS 10.13 or higher</a> to continue to use Roblox Studio.","Starting at the end of May 2022 we will be discontinuing support for OS X 10.11 and MacOS 10.12.  <a href=""https://support.apple.com/en-us/HT211683"">Please upgrade to MacOS 10.13 or higher</a> to continue to use Roblox Studio.",,"Ab Ende Mai 2022 werden wir die Unterstützung für OS X 10.11 und macOS 10.12 einstellen.  <a href=""https://support.apple.com/en-us/HT211683"">Bitte aktualisiere auf macOS 10.13 oder höher</a>, um Roblox Studio weiterhin nutzen zu können.","A partir de finales de mayo de 2022 dejaremos de soportar OS X 10.11 y MacOS 10.12.  <a href=""https://support.apple.com/en-us/HT211683"">Actualiza a MacOS 10.13 o superior</a> para continuar usando Roblox Studio.","À partir de la fin du mois de mai 2022, nous allons cesser de supporter OS X 10.11 et MacOS 10.12.  <a href=""https://support.apple.com/en-us/HT211683"">Passer à MacOS 10.13 ou plus</a> pour continuer à utiliser Roblox Studio.","Mulai akhir Mei 2022, kami tidak akan lagi menyediakan dukungan untuk OS X 10.11 dan MacOS 10.12. <a href=""https://support.apple.com/en-us/HT211683"">Silakan upgrade ke MacOs 10.13 atau versi lebih baru</a> untuk terus menggunakan Roblox Studio.","A partire dalla fine di maggio 2022 interromperemo il supporto per OS X 10.11 e MacOS 10.12.  <a href=""https://support.apple.com/en-us/HT211683"">Si prega di aggiornare a MacOS 10.13 o superiore</a> per continuare a utilizzare Roblox Studio.","2022年5月末を持ちまして、当社はOS X 10.11 と MacOS 10.12への対応を終了しました。  <a href=""https://support.apple.com/en-us/HT211683"">Roblox Studioを使用し続けるには、MacOS 10.13 以降のバージョンにアップグレードしてください。</a>","2022년 5월 말부터 OS X 10.11 및 MacOS 10.12에 대한 지원이 중단됩니다. Roblox Studio를 계속 사용하려면 <a href=""https://support.apple.com/en-us/HT211683"">MacOS 10.13 이상</a>으로 업그레이드하세요</a>.",,"A partir de junho de 2022, suspenderemos o suporte para OS X 10.11 e MacOS 10.12.  <a href=""https://support.apple.com/en-us/HT211683"">Atualize seu sistema para MacOS 10.13 ou superior</a> para continuar usando o Roblox Studio.",,,"2022'nin Mayıs ayının sonundan itibaren OS X 10.11 ve MacOS 10.12 için desteği sonlandıracağız. Roblox Studio kullanmaya devam edebilmek için lütfen <a href=""https://support.apple.com/en-us/HT211683"">lütfen MacOS 10.13 ya da daha güncel bir sürüme geçiş yap</a>.","Bắt đầu từ cuối tháng 5 năm 2022, chúng tôi sẽ ngừng hỗ trợ cho OS X 10.11 và MacOS 10.12.  <a href=""https://support.apple.com/vi-vn/102662"">Vui lòng nâng cấp lên MacOS 10.13 trở lên</a> để tiếp tục sử dụng Roblox Studio.","从 2022 年 5 月底开始，我们将开始停止支持 OS X 10.11 及 MacOS 10.12。若要继续使用 Roblox Studio，请<a href=""https://support.apple.com/zh-tw/HT211683"">升级至 MacOS 10.13 或更高版本</a>。","从 2022 年 5 月底开始，我们将开始停止支持 OS X 10.11 及 MacOS 10.12。若要继续使用 Roblox Studio，请<a href=""https://support.apple.com/zh-tw/HT211683"">升级至 MacOS 10.13 或更高版本</a>。","我們從 2022 年 5 月底開始將會停止支援 OS X 10.11 盒 MacOS 10.12。若要繼續使用 Roblox Studio，請<a href=""https://support.apple.com/zh-tw/HT211683"">升級到 MacOS 10.13 或更新版本</a>。"
Studio.UpdateNotifications.Ribbon.ChannelUpdateAvailable,,,Channel Update Available,Channel Update Available,,Kanal-Update verfügbar,Actualización de canal disponible,Mise à jour de la chaîne disponible,,,チャンネルの更新が利用できます,채널 업데이트 가능,,Atualização de canal disponível,,,Kanal güncellemesi mevcut,Có Bản Cập Nhật Kênh,有频道更新可用,有频道更新可用,有可使用的頻道更新
Studio.UpdateNotifications.Ribbon.ChannelUpdateAvailableMessage,,,Private channel updates do not occur automatically on startup. Perform update now?,Private channel updates do not occur automatically on startup. Perform update now?,,Updates für private Kanäle werden beim Start nicht automatisch durchgeführt. Update jetzt durchführen?,Las actualizaciones del canal privado no ocurren automáticamente al inicio. ¿Realizar actualización ahora?,Les mises à jour de canal privé ne se produisent pas automatiquement au démarrage. Effectuer la mise à jour maintenant ?,,,プライベートチャンネルの更新は起動時に自動的には起きません。今すぐ更新しますか？,비공개 채널 업데이트는 시작 시 자동으로 진행되지 않습니다. 지금 업데이트를 수행할까요?,,As atualizações do canal privado não ocorrerão automaticamente na inicialização. Executar atualização agora?,,,Özel kanal güncellemeleri başlangıçta otomatik olarak gerçekleşmez. Güncelleme şimdi yapılsın mı?,Các bản cập nhật kênh riêng không tự động áp dụng khi khởi động. Cập nhật ngay bây giờ?,私人频道更新不会在启动时自动执行。是否立即执行更新？,私人频道更新不会在启动时自动执行。是否立即执行更新？,私人頻道在啟動時不會自動更新。要立即更新嗎？
Studio.UpdateNotifications.Ribbon.ChannelUpdateAvailableQuestion,,,Would you like to get channel update and restart?,Would you like to get channel update and restart?,,Möchtest du das Kanal-Update durchführen und neu starten?,¿Te gustaría obtener la actualización del canal y reiniciar?,Veux-tu obtenir la mise à jour du canal et le redémarrer ?,,Vuoi ottenere l'aggiornamento del canale e riavviare?,チャンネルの更新をして再起動しますか？,채널을 업데이트하고 다시 시작할까요?,,Você gostaria de obter a atualização do canal e reiniciar?,,,Kanal güncellemesini alıp yeniden başlatmak istiyor musun?,Bạn có muốn cập nhật và khởi động lại kênh không?,你要获取频道更新并重启吗？,你要获取频道更新并重启吗？,您想取得頻道更新並重新啟動嗎？
Studio.UpdateNotifications.Ribbon.ChannelUpdateAvailableDescription,,,An update is available for the channel you're enrolled in: %1. Private channel updates do not occur automatically on startup.,An update is available for the channel you're enrolled in: %1. Private channel updates do not occur automatically on startup.,,"Für den Kanal, in dem du angemeldet bist, ist ein Update verfügbar: %1. Updates für private Kanäle werden beim Start nicht automatisch durchgeführt.",Hay una actualización disponible para el canal en el que te inscribiste: %1. Las actualizaciones del canal privado no se dan automáticamente al iniciar.,Une mise à jour est disponible pour la chaîne à laquelle tu t'inscris : %1. Les mises à jour du canal privé ne se produisent pas automatiquement au démarrage.,,È disponibile un aggiornamento per il canale a cui sei iscritto: %1. Gli aggiornamenti del canale privato non si attivano automaticamente all'avvio.,登録しているチャンネルの更新が利用可能です: %1 プライベートチャンネルの更新は起動時に自動的には起きません。,등록하신 채널 %1에 대한 업데이트가 있습니다. 비공개 채널 업데이트는 시작 시 자동으로 실행되지 않습니다.,,Uma atualização está disponível para o canal em que você está inscrito: %1. As atualizações do canal privado não ocorrem automaticamente na inicialização.,,,İçinde bulunduğun kanal için bir güncelleme mevcut (%1). Özel kanal güncellemeleri başlangıçta otomatik olarak gerçekleşmez.,Bản cập nhật hiện đã có cho kênh bạn đã đăng ký: %1. Các bản cập nhật kênh riêng không tự động áp dụng khi khởi động.,有更新可用于你注册的频道：%1。私人频道更新不会在启动时自动执行。,有更新可用于你注册的频道：%1。私人频道更新不会在启动时自动执行。,您所加入的頻道有可以使用的更新：%1。私人頻道在啟動時不會自動更新。
Studio.UpdateNotifications.Ribbon.ChannelUpdateAvailableAccept,,,Update,Update,,Aktualisieren,Actualizar,Mise à jour,,Aggiorna,更新,업데이트,,Atualizar,,,Güncelle,Cập Nhật,更新,更新,更新
