Key,Source,en-us,es-es,fr-fr,it-it,ja-jp,ko-kr,pt-br,ru-ru,zh-cjv,zh-cn,zh-tw
Studio.PluginInstallation.Meta.PluginWindowName,Plugin Installation,Plugin Installation,Instalación del plugin,Installation plugin,Installazione plugin,プラグインのインストール,플러그인 설치,Instalação de plugin,Установка плагина,插件安装,插件安装,外掛程式安裝
Studio.PluginInstallation.Details.Back,Back,Back,Volver,Retour,Indietro,戻る,뒤로,Voltar,Назад,返回,返回,返回
Studio.PluginInstallation.Main.InstallingPlugin,Installing plugin : {1},Installing plugin : {1},Instalando plugin: {1},Installer le plugin : {1},Installazione del plugin: {1},プラグインをインストール中 : {1},플러그인 설치: {1},Instalando plugin: {1},Установка плагина: {1},正在安装插件： {1},正在安装插件： {1},正在安裝外掛程式：{1}
Studio.PluginInstallation.Progress.HttpError,HTTP Error. Could not fetch information about this plugin. Try again later. {1},HTTP Error. Could not fetch information about this plugin. Try again later. {1},Error de HTTP. No se ha podido recuperar la información sobre este plugin. Inténtalo de nuevo más tarde. {1},Erreur HTTP. Le cloud ne peut pas aller chercher les informations de ce plugin. Réessaie plus tard. {1},Errore HTTP. Impossibile recuperare le informazioni su questo plugin. Riprova più tardi. {1},HTTPエラー。このプラグインに関する情報を取得できませんでした。また後でお試しください。 {1},HTTP 오류. 이 플러그인에 대한 정보를 가져오지 못했습니다. 나중에 다시 시도하세요. {1},Erro HTTP. Não foi possível obter informações sobre este plugin. Tente novamente mais tarde. {1},Ошибка HTTP. Не удалось получить информацию о плагине. Повторите попытку позже. {1},HTTP 错误。无法获取关于此插件的信息，请稍后重试。{1},HTTP 错误。无法获取关于此插件的信息，请稍后重试。{1},HTTP 錯誤。無法擷取此外掛程式的資訊。請稍後再試。{1}
Studio.PluginInstallation.PluginEntry.AutoUpdateEntry,Last updated on {date:shortdate},Last updated on {date:shortdate},Última actualización el {date:shortdate},Dernière mise à jour le {date:shortdate},Ultimo aggiornamento il {date:shortdate},最終更新日: {date:shortdate},마지막 업데이트 날짜: {date:shortdate},Última atualização em {date:shortdate}, , , ,最後更新日期：{date:shortdate}
Studio.PluginInstallation.Main.ErrorNoId,Error : No plugin to install,Error : No plugin to install,Error: No hay plugin que instalar,Erreur : pas de plugin à installer,Errore: nessun plugin da installare,エラー : インストールするプラグインがありません,오류: 설치할 플러그인이 없음,Erro: Não há plugin para instalar,Ошибка: плагин не установлен,错误：未发现可安装的插件,错误：未发现可安装的插件,錯誤：沒有要安裝的外掛程式
Studio.PluginInstallation.Progress.CompletedMessage,{1} successfully installed.,{1} successfully installed.,{1} se instaló correctamente.,{1} installé avec succès.,Installazione di {1} completata.,{1} をインストールできました。,{1}을(를) 설치했습니다.,{1} instalado com sucesso.,Плагин {1} установлен.,已成功安装 {1} 。,已成功安装 {1} 。,已成功安裝 {1}。
Studio.PluginInstallation.Details.ScriptInjection,Script Injection,Script Injection,Inyección del script,Injection de script,Iniezione di script,スクリプト注入,스크립트 삽입,Injeção de script, ,脚本注入,脚本注入,指令碼注入
Studio.PluginInstallation.Progress.Completed,Installation Complete!,Installation Complete!,¡Instalación completada!,Installation terminée !,Installazione completata!,インストール完了！,설치 완료!,Instalação completada!,Установка завершена!,安装完成！,安装完成！,安裝完成！
Studio.PluginInstallation.Dialog.Ok,OK,OK,Aceptar,OK,OK,OK,확인,OK,ОК,确认,确认,確定
Studio.PluginInstallation.PluginEntry.AutoUpdateText,Auto Update,Auto Update,Actualización automática,Mise à jour automatique,Aggiornamento Automatico,自動アップデート,자동 업데이트,Atualização automática, , , ,自動更新
Studio.PluginInstallation.Details.HttpRequestInfo,"By allowing HTTP requests, 3rd party developers are able to gather information on your machine. These might be harmless (such as crash logs) or malicious (such as gathering information on your game's scripts). Disabling HTTP requests might result in a non-working plugin.","By allowing HTTP requests, 3rd party developers are able to gather information on your machine. These might be harmless (such as crash logs) or malicious (such as gathering information on your game's scripts). Disabling HTTP requests might result in a non-working plugin.","Al permitir solicitudes HTTP, los desarrolladores terceros pueden reunir la información en tu equipo. Algunas de ellas pueden ser inocuas (como registros de caídas del sistema), otras malintencionadas (como reunir información sobre los scripts de tu juego). Es posible que el plugin deje de funcionar si se desactivan las solicitudes HTTP.","En autorisant les requêtes HTTP, les développeurs tiers sont en mesure de recueillir des informations sur ta machine. Ces informations peuvent être inoffensives (comme les logs de crash) ou malveillantes (comme la collecte d'informations sur les scripts de votre jeu). La désactivation des requêtes HTTP peut entraîner le non-fonctionnement d'un plugin.","Consentendo le richieste HTTP, gli sviluppatori di terzi potranno raccogliere informazioni sulla tua macchina. Potranno essere innocui (come arresti anomali) o malevoli (come la raccolta di informazioni sugli script del tuo gioco). Disabilitare le richieste HTTP potrebbe non far funzionare il plugin.",HTTPリクエストを許可することで、サードパーティ開発者はあなたの端末で情報収集ができます。これらは無害である（クラッシュログのように）か有害（あなたのゲームスクリプトで情報収集するなど）です。HTTPリクエストを無効化すると、非可動プラグインになる可能性があります。,HTTP 요청을 허용하면 타사 개발자가 내 컴퓨터에 대한 정보를 수집할 수 있게 됩니다. 이는 무해(예: 충돌 로그)하거나 악의적(예: 게임 스크립트에 대한 정보 수집)일 수 있습니다. HTTP 요청을 비활성화하면 플러그인이 작동하지 않을 수 있습니다.,"Ao permitir requisições HTTP, outros desenvolvedores podem obter informações sobre seu computador. Estas informações podem ser inofensivas (como logs de pane do sistema) ou maliciosas (como informações de seus scripts de jogo). Desativar requisições HTTP pode resultar em um plugin não-funcional.", ,允许 HTTP 请求运行后，第三方开发者将可以从您的电脑上收集各类信息。其中可能包括无害信息（例如崩溃日志等）或有害信息（例如您的游戏脚本信息等）。禁用 HTTP 请求可能会导致插件失效。,允许 HTTP 请求运行后，第三方开发者将可以从您的电脑上收集各类信息。其中可能包括无害信息（例如崩溃日志等）或有害信息（例如您的游戏脚本信息等）。禁用 HTTP 请求可能会导致插件失效。,允許 HTTP 請求後，第三方開發者就可以從您的裝置上收集資訊。收集的資訊可能無害（當機報告等）或有害（偷取遊戲指令碼資訊等）。停用 HTTP 請求可能會導致外掛程式運作異常。
Studio.PluginInstallation.DialogTitle.InstallPlugin,Installing plugin,Installing plugin,Instalando plugin,Installer plugin,Installazione del plugin,プラグインをインストール中,플러그인 설치,Instalando plugin,Установка плагина,正在安装插件,正在安装插件,正在安裝外掛程式
Studio.PluginInstallation.Progress.NotOwned,You do not own this plugin. {1},You do not own this plugin. {1},No tienes este plugin. {1},Tu n'as pas ce plugin. {1},Non possiedi questo plugin. {1},このプラグインを所有していません。 {1},이 플러그인을 소유하고 있지 않습니다. {1},Você não possui este plugin. {1},Вы не владеете этим плагином. {1},你尚未拥有当前插件。{1},你尚未拥有当前插件。{1},您不擁有此外掛程式。{1}
Studio.PluginInstallation.Progress.Unavailable,Could not fetch information about this plugin. Try again later. {1},Could not fetch information about this plugin. Try again later. {1},No se ha podido recuperar la información sobre este plugin. Inténtalo de nuevo más tarde. {1},Impossible d'aller chercher les informations de ce plugin. Réessaie plus tard. {1},Impossibile recuperare le informazioni su questo plugin. Riprova più tardi. {1},このプラグインに関する情報を取得できませんでした。また後でお試しください。 {1},이 플러그인에 대한 정보를 가져오지 못했습니다. 나중에 다시 시도하세요. {1},Não foi possível obter informações sobre este plugin. Tente novamente mais tarde. {1},Не удалось получить информацию о плагине. Повторите попытку позже. {1},无法获取关于此插件的信息，请稍后重试。{1},无法获取关于此插件的信息，请稍后重试。{1},無法擷取此外掛程式的資訊，請稍後再試。{1}
Studio.PluginInstallation.Progress.NotInstalled,Plugin Installation Failed. Please try again. {1},Plugin Installation Failed. Please try again. {1},Error en la instalación del plugin. Inténtalo de nuevo más tarde. {1},Echec de l'installation plugin. Réessaie plus tard. {1},Impossibile installare il plugin. Riprova. {1},プラグインのインストールができませんでした。もう一度お試しください。 {1},플러그인을 설치하지 못했습니다. 나중에 다시 시도하세요. {1},Falha na instalação do plugin. Tente novamente. {1},Неудачная установка плагина. Повторите попытку позже. {1},插件安装失败，请稍后重试。{1},插件安装失败，请稍后重试。{1},外掛程式安裝失敗，請重新嘗試。{1}
Studio.PluginInstallation.Details.Creator,Creator,Creator,Creador,Créateur,Creatore,クリエーター,크리에이터,Criador,Автор,创建者,创建者,創作者
Studio.PluginInstallation.Loading.UpdatingMessage,Updating plugins...,Updating plugins...,Actualizando plugins...,Mise à jour des plugins...,Aggiornamento plugin...,プラグインをアップデート中...,플러그인 업데이트 중...,Atualizando plugins...,Обновляются плагины...,正在更新插件…,正在更新插件…,正在更新外掛程式……
Studio.PluginInstallation.Progress.AlreadyInstalled,This plugin is already installed. {1},This plugin is already installed. {1},El plugin ya está instalado. {1},Ce plugin est déjà installé. {1},Questo plugin è già installato. {1},このプラグインはすでにインストール済みです。 {1},이 플러그인은 이미 설치되어 있습니다. {1},Este plugin já está instalado. {1},Этот плагин уже установлен. {1},此插件已经安装完毕。{1},此插件已经安装完毕。{1},此外掛程式已安裝。{1}
Studio.PluginInstallation.Manage.WindowTitle,Plugin Management,Plugin Management,Administrador de plugin,Gestion des plugins,Gestione plugin,プラグイン管理,플러그인 관리,Gerenciador de plugins,Управление плагинами,插件管理,插件管理,外掛程式管理
Studio.PluginInstallation.Toolbar.ToolbarTitle,Tools,Tools,Herramientas,Outils,Strumenti,ツール,도구,Ferramentas,Инструменты,工具,工具,工具
Studio.PluginInstallation.Moved.GotIt,Got it,Got it,¡Entendido!,J'ai trouvé,Capito,了解,확인,Entendi,Ясно,了解,了解,知道了
Studio.PluginInstallation.Toolbar.ManageButtonTitle,Manage Plugins,Manage Plugins,Gestionar plugins,Gérer les plugins,Gestisci plugin,プラグインを管理,플러그인 관리,Gerenciar plugins,Управление плагинами,管理插件,管理插件,管理外掛程式
Studio.PluginInstallation.Toolbar.ManageButtonDescription,Manage plugins installed from roblox.com,Manage plugins installed from roblox.com,Gestiona plugins instalados desde roblox.com,Gérer les plugins installés de roblox.com,Gestisci plugin installati su roblox.com,Roblox.comからインストールしたプラグインを管理,roblox.com에서 설치한 플러그인 관리,Gerenciar plugins instalados a partir de roblox.com,Управление установленными плагинами с сайта roblox.com,管理从 roblox.com 安装的插件,管理从 roblox.com 安装的插件,管理從 roblox.com 安裝的外掛程式
Studio.PluginInstallation.Loading.Title,Updating Plugins,Updating Plugins,Actualizando plugins,Mise à jour des plugins,Aggiornamento plugin,プラグインをアップデート中,플러그인 업데이트,Atualizando plugins,Обновляются плагины,正在更新插件,正在更新插件,正在更新外掛程式
Studio.PluginInstallation.Main.Title,Plugins,Plugins,Plugins,Plugins,Plugin,プラグイン,플러그인,Plugins,Плагины,插件,插件,外掛程式
Studio.PluginInstallation.Main.UpdateAllButton,Update all,Update all,Actualizar todos,Tout mettre à jour,Aggiorna tutto,すべてアップデート,모두 업데이트,Atualizar tudo,Обновить все,全部更新,全部更新,全部更新
Studio.PluginInstallation.Main.NoPluginsMessage,You haven’t installed any plugins yet.,You haven’t installed any plugins yet.,Todavía no has instalado ningún plugin.,Tu n'as pas encore installé de plugins.,Non hai ancora installato alcun plugin.,まだプラグインをインストールしていません。,설치된 플러그인이 없습니다.,Você ainda não instalou plugins.,Ни один плагин пока не установлен.,你尚未安装任何插件。,你尚未安装任何插件。,您尚未安裝外掛程式。
Studio.PluginInstallation.Main.FindPluginsMessage_Old,Find plugins now,Find plugins now,Buscar plugins ahora,Trouver des plugins,Trova plugin ora,今、プラグインを見つける,지금 플러그인 찾기,Pesquisar plugins,Найти плагины,立即查找插件,立即查找插件,現在尋找外掛程式
Studio.PluginInstallation.Main.FindPluginsMessage,"To find more plugins, open Toolbox > Marketplace > Plugins.","To find more plugins, open Toolbox > Marketplace > Plugins.","Para encontrar más plugins, abre Herramientas > Mercado > Plugins.","Pour trouver davantage de plugins, ouvre Toolbox > Marketplace > Plugins.","To trovare altri plugin, apri Toolbox > Mercato > Plugin.",プラグインをもっと見つけるには、ツールボックスを開く > マーケットプレース > プラグイン。,더 많은 플러그인을 찾으려면 도구 상자 > 마켓플레이스 > 플러그인을 여세요.,Para encontrar mais plugins abra a Caixa de Ferramentas > Mercado > Plugins.,Для поиска плагинов откройте раздел «Панель инструментов» > «Магазин» > «Плагины».,要查找更多插件，请打开“工具箱 > 商店 > 插件”。,要查找更多插件，请打开“工具箱 > 商店 > 插件”。,若要尋找更多外掛程式，請前往工具箱 > 商城 > 外掛程式。
Studio.PluginInstallation.Entry.UpdateButton,Update,Update,Actualizar,Mise à jour,Aggiorna,アップデート,업데이트,Atualizar,Обновить,更新,更新,更新
Studio.PluginInstallation.Entry.LastUpdatedDate,Updated: {date:shortdate},Updated: {date:shortdate},Actualizado: {date:shortdate},Mis à jour : {date:shortdate},Aggiornamento: {date:shortdate},アップデート済み: {date:shortdate},업데이트됨: {date:shortdate},Atualizado(s): {date:shortdate},Обновлено: {date:shortdate},更新日期：{date:shortdate},更新日期：{date:shortdate},更新日期：{date:shortdate}
Studio.PluginInstallation.Entry.UpdateError,Error. Try updating again.,Error. Try updating again.,Error. Intenta actualizar de nuevo.,Erreur. Réessaie de mettre à jour.,Errore. Prova ad aggiornare di nuovo.,エラー。もう一度アップデートしてみてください。,오류. 업데이트를 다시 시도하세요.,Erro. Tente atualizar novamente.,Ошибка. Повторите обновление позже.,发生错误。请尝试再次更新。,发生错误。请尝试再次更新。,發生錯誤，請重新嘗試更新。
Studio.PluginInstallation.Entry.UpdateSuccess,Update complete!,Update complete!,¡Actualización completada!,Mise à jour complète !,Aggiornamento completato!,アップデート完了！,업데이트 완료!,Atualização completa!,Обновление завершено!,更新完成！,更新完成！,更新完成！
Studio.PluginInstallation.EntrySeeMore.RemoveButton,Uninstall,Uninstall,Desinstalar,Désinstaller,Disinstalla,アンインストール,제거,Desinstalar,Удалить,卸载,卸载,解除安裝
Studio.PluginInstallation.Entry.ModeratedWarning,This plugin includes malicious content and can’t be run anymore.,This plugin includes malicious content and can’t be run anymore.,Este plugin contiene contenido malicioso y ya no se puede ejecutar.,Ce plugin comprend du contenu malveillant et ne peut plus être exécuté.,Questo plugin include contenuti malevoli e non può essere più eseguito.,このプラグインには有害なコンテンツが含まれるのでもう実行できません。,이 플러그인에는 악성 콘텐츠가 들어 있어 더 이상 실행할 수 없습니다.,Este plugin possui conteúdo malicioso e não pode mais ser executado.,Этот плагин содержит вредоносный контент и больше не может быть запущен.,此插件包含恶意内容，无法继续使用。,此插件包含恶意内容，无法继续使用。,此外掛程式包含惡意內容，無法繼續運行。
Studio.PluginInstallation.EntrySeeMore.DetailsButton,Details,Details,Detalles,Détails,Dettagli,詳細,세부 정보,Detalhes,Подробнее,详情,详情,詳細資料
Studio.PluginInstallation.Header.PendingUpdates,Pending updates,Pending updates,Actualizaciones pendientes,Mises à jour en attente,Aggiornamenti in sospeso,保留中のアップデート,업데이트 보류 중,Atualizações pendentes,Ожидающие обновления,待更新,待更新,待套用更新
Studio.PluginInstallation.Moved.NewLocationMessage,Get plugins from Marketplace under Toolbox.,Get plugins from Marketplace under Toolbox.,"Obtén plugins de Mercado, bajo Herramientas.",Trouver des plugins du Marketplace sous Toolbox.,Ottieni i plugin dal mercato sotto Toolbox.,ツールボックスの下のマーケットプレースからプラグインを取得。,도구 상자 아래의 마켓플레이스에서 플러그인을 받으세요.,Obtenha plugins do Mercado na Caixa de ferramentas.,Плагины находятся в разделе «Панель инструментов» > «Магазин».,请到“工具箱”下的“商店”中获取插件。,请到“工具箱”下的“商店”中获取插件。,請在工具箱裡的商城取得外掛程式。
Studio.PluginInstallation.Header.UpToDate,Up to date,Up to date,Actualizado,Mis à jour,Aggiornato,最新,최신 상태,Atualizado,Обновлено,最新版本,最新版本,最新
Studio.PluginInstallation.Moved.Title,Roblox Studio,Roblox Studio,Roblox Studio,Roblox Studio,Roblox Studio,Roblox Studio,Roblox Studio,Roblox Studio,Roblox Studio,Roblox Studio,Roblox Studio,Roblox Studio
Studio.PluginInstallation.Moved.MovedMessage,We've moved.,We've moved.,Nos trasladamos.,Nous avons déménagé.,Ci siamo spostati.,移動しました。,이동시켰습니다.,Nos mudamos.,Мы переехали.,我们已经搬移。,我们已经搬移。,我們搬家了。
Studio.PluginInstallation.Details.HttpRequests,HTTP Requests,HTTP Requests,Solicitudes HTTP,Demandes HTTP,Richieste HTTP,HTTPリクエスト,HTTP 요청,Requisições HTTP,HTTP-запросы,HTTP 请求,HTTP 请求,HTTP 請求
Studio.PluginInstallation.PluginEntry.HttpRequest,HTTP Requests,HTTP Requests,Solicitudes HTTP,Demandes HTTP,Richieste HTTP,HTTPリクエスト,HTTP 요청,Requisições HTTP, ,HTTP 请求,HTTP 请求,HTTP 請求
Studio.PluginInstallation.Details.Description,Description,Description,Descripción,Description,Descrizione,詳細,설명,Descrição,Описание,描述,描述,說明
Studio.PluginInstallation.PluginEntry.ScriptInjectionAllowed,Script Injection Allowed,Script Injection Allowed,Inyección del script permitida,Injection de script autorisée,Iniezione di script consentita,スクリプト注入を許可済み,스크립트 삽입이 허용됨,Injeção de scripts permitida, ,已允许脚本注入,已允许脚本注入,已允許指令碼注入
Studio.PluginInstallation.Details.ScriptInjectionInfo,"By allowing Script Injection, this plugin may insert or modify scripts that perform malicious actions anywhere in your game (scripts can pretty much do anything). Disabling Script Injection might result in a non-working plugin.","By allowing Script Injection, this plugin may insert or modify scripts that perform malicious actions anywhere in your game (scripts can pretty much do anything). Disabling Script Injection might result in a non-working plugin.","Al permitir la Inyección del script, este plugin puede insertar o modificar los scripts para realizar acciones que perjudiquen tu juego (los scripts pueden hacer cualquier cosa). Si desactivas la Inyección del script, el plugin puede dejar de funcionar.","En autorisant l'injection de script, ce plugin peut insérer ou modifier des scripts qui effectuent des actions malveillantes n'importe où dans votre jeu (les scripts peuvent à peu près tout faire). La désactivation de l'injection de script peut entraîner un dysfonctionnement du plugin.","Consentendo l'iniezione di script, questo plugin potrà inserire o modificare gli script che eseguono azioni malevole in ogni parte del gioco (gli script possono fare praticamente ogni cosa). Disabilitare l'iniezione di script potrebbe non far funzionare il plugin.",スクリプト注入を許可することで、このプラグインはあなたのゲーム内のどこでも不正な動作を行うスクリプトを挿入または変更することができます（スクリプトはほぼ何でもできます）。スクリプト注入を無効化すると、プラグインが機能しなくなるかもしれません。　,"스크립트 삽입을 허용하면, 플러그인은 스크립트를 삽입하거나 수정하여 게임 내 곳곳에서 악의적인 작업을 수행할 수 있습니다(스크립트는 거의 모든 작업을 수행할 수 있음). 스크립트 삽입을 비활성화하면 플러그인이 작동하지 않을 수 있습니다.","Ao permitir injeção de script, seu plugin pode inserir ou modificar scripts que causam ações maliciosas em qualquer lugar do seu jogo (scripts podem fazer qualquer coisa). Desativar injeção de scripts pode resultar em um plugin não-funcional.", ,若允许脚本注入，此插件可能会通过注入或修改脚本在游戏中的任何地方进行恶意操作（脚本几乎是万能的）。禁用脚本注入则可能会使插件无法生效。,若允许脚本注入，此插件可能会通过注入或修改脚本在游戏中的任何地方进行恶意操作（脚本几乎是万能的）。禁用脚本注入则可能会使插件无法生效。,允許指令碼注入後，此外掛程式將能在您的遊戲裡插入或修改指令碼，使他們惡意影響遊戲運行。（指令碼可以做的事情很多！）若停用指令碼注入，外掛程式將可能無法運作。
Studio.PluginInstallation.Main.FindPluginsWithButtonMessage,"To find more plugins, open Marketplace by clicking the '+' button.","To find more plugins, open Marketplace by clicking the '+' button.","Para encontrar más plugins, abre Mercado haciendo clic en el botón \"+\".","Pour trouver d'autres plugins, ouvre Marketplace en cliquant sur le bouton \"+\".","Per trovare altri plugin, apri il Mercato cliccando il pulsante \"+\".",もっとプラグインを見つけるには、「+」ボタンをクリックして マーケットプレースを開きます。,더 많은 플러그인을 찾으려면 '+' 버튼을 클릭하여 마켓플레이스를 엽니다.,"Para encontrar mais plugins, abra o Mercado clicando no botão '+'.", ,要寻找更多插件，请点击 '+' 按钮打开商店。,要寻找更多插件，请点击 '+' 按钮打开商店。,若要尋找更多外掛程式，請點擊「+」按鈕開啟商城。
Studio.PluginInstallation.PluginEntry.ScriptInjectionDenied,Script Injection Denied,Script Injection Denied,Inyección del script denegada,Injection de script refusée,Iniezione di script negata,スクリプト注入を却下済み,스크립트 삽입이 거부됨,Injeção de script negada, ,已拒绝脚本注入,已拒绝脚本注入,已拒絕指令碼注入
Studio.PluginInstallation.PluginEntry.NoPermissionsRequested,No Permissions Requested,No Permissions Requested,No se han solicitados permisos,Aucune autorisation demandée,Nessun permesso richiesto,権限リクエストがありません,요청된 권한 없음,Sem pedidos de permissão, ,未请求权限,未请求权限,未請求權限